"TIPO";"PERIODO";"CO_ANO";"CO_PAIS";"NO_PAIS";"CO_PAIS_ISOA3";"NO_PPE_PPI";"NO_FAT_AGREG";"VL_FOB";"KG_LIQUIDO"
"EXPORTAÇÕES";"Jan-Abr";"2015";"160";"China";"CHN";"Abrasivos e pedras para amolar e semelhantes";"Produtos Manufaturados";328523;5529
"EXPORTAÇÕES";"Jan-Abr";"2015";"160";"China";"CHN";"Aceleradores de reação e preparações catalíticas";"Produtos Manufaturados";2737;30
"EXPORTAÇÕES";"Jan-Abr";"2015";"160";"China";"CHN";"Acetatos,nitratos, éteres de celulose e outs. derivados";"Produtos Manufaturados";54518;10050
"EXPORTAÇÕES";"Jan-Abr";"2015";"160";"China";"CHN";"Ácidos carboxílicos, seus anidridos, halogenetos, etc.";"Produtos Manufaturados";58495;15355
"EXPORTAÇÕES";"Jan-Abr";"2015";"160";"China";"CHN";"Açúcar de cana, em bruto";"Produtos Semimanufaturados";242426442;728498375
"EXPORTAÇÕES";"Jan-Abr";"2015";"160";"China";"CHN";"Açúcar refinado";"Produtos Manufaturados";405;450
"EXPORTAÇÕES";"Jan-Abr";"2015";"160";"China";"CHN";"Aditivos para óleos lubrificantes";"Produtos Manufaturados";1819946;750530
"EXPORTAÇÕES";"Jan-Abr";"2015";"160";"China";"CHN";"Álcoóis acíclicos e seus derivados halogenados, etc.";"Produtos Manufaturados";8563555;15530365
"EXPORTAÇÕES";"Jan-Abr";"2015";"160";"China";"CHN";"Algodão em bruto";"Produtos Básicos";40464784;24099976
"EXPORTAÇÕES";"Jan-Abr";"2015";"160";"China";"CHN";"Alumínio em desperdícios e resíduos";"Produtos Básicos";1313636;856284
"EXPORTAÇÕES";"Jan-Abr";"2015";"160";"China";"CHN";"Alumínio, em barras, perfis, fios,chapas,folhas e tiras";"Produtos Manufaturados";1551;116
"EXPORTAÇÕES";"Jan-Abr";"2015";"160";"China";"CHN";"Antibióticos";"Produtos Manufaturados";339881;970
"EXPORTAÇÕES";"Jan-Abr";"2015";"160";"China";"CHN";"Aparelhos de fotocópia e de termocópia";"Produtos Manufaturados";58147;6353
"EXPORTAÇÕES";"Jan-Abr";"2015";"160";"China";"CHN";"Aparelhos e dispositivos eletr. de ignição ou arranque";"Produtos Manufaturados";317121;4762
"EXPORTAÇÕES";"Jan-Abr";"2015";"160";"China";"CHN";"Aparelhos eletr.de iluminação ou sinaliz. p/ automóveis";"Produtos Manufaturados";1725992;89385
"EXPORTAÇÕES";"Jan-Abr";"2015";"160";"China";"CHN";"Aparelhos eletro-mecânicos ou térmicos,de uso doméstico";"Produtos Manufaturados";46971;579
"EXPORTAÇÕES";"Jan-Abr";"2015";"160";"China";"CHN";"Aparelhos mecânicos p/projetar/pulverizar líquidos/pós";"Produtos Manufaturados";245278;69082
"EXPORTAÇÕES";"Jan-Abr";"2015";"160";"China";"CHN";"Aparelhos p/cozinhar,aquecedores de pratos, suas partes";"Produtos Manufaturados";886;21
"EXPORTAÇÕES";"Jan-Abr";"2015";"160";"China";"CHN";"Aparelhos p/interrupção,proteção de energia,suas partes";"Produtos Manufaturados";887528;24595
"EXPORTAÇÕES";"Jan-Abr";"2015";"160";"China";"CHN";"Aparelhos transmissores ou receptores e componentes";"Produtos Manufaturados";9062740;176803
"EXPORTAÇÕES";"Jan-Abr";"2015";"160";"China";"CHN";"Aquecedor, secador ou trocador de calor, partes e pecas";"Produtos Manufaturados";50789;215
"EXPORTAÇÕES";"Jan-Abr";"2015";"160";"China";"CHN";"Ardósia natural e obras de ardósia";"Produtos Manufaturados";102566;233132
"EXPORTAÇÕES";"Jan-Abr";"2015";"160";"China";"CHN";"Armações e cabos de ferramentas ou vassouras,de madeira";"Produtos Manufaturados";18473;12080
"EXPORTAÇÕES";"Jan-Abr";"2015";"160";"China";"CHN";"Artigos de joalheria de metais preciosos e suas partes";"Produtos Manufaturados";87582;2
"EXPORTAÇÕES";"Jan-Abr";"2015";"160";"China";"CHN";"Artigos de plástico para transporte ou para embalagem";"Produtos Manufaturados";354382;72255
"EXPORTAÇÕES";"Jan-Abr";"2015";"160";"China";"CHN";"Artigos e apars. de prótese, de ortopedia e suas partes";"Produtos Manufaturados";5888;49
"EXPORTAÇÕES";"Jan-Abr";"2015";"160";"China";"CHN";"Automóveis de passageiros";"Produtos Manufaturados";30000;1202
"EXPORTAÇÕES";"Jan-Abr";"2015";"160";"China";"CHN";"Barras, perfis e fios de níquel";"Produtos Manufaturados";5413;202
"EXPORTAÇÕES";"Jan-Abr";"2015";"160";"China";"CHN";"Bombas, compressores, ventiladores, etc. e suas partes";"Produtos Manufaturados";18418967;2005914
"EXPORTAÇÕES";"Jan-Abr";"2015";"160";"China";"CHN";"Borracha misturada,n/vulcan.em forma primar,chapas,fls.";"Produtos Manufaturados";1528556;148294
"EXPORTAÇÕES";"Jan-Abr";"2015";"160";"China";"CHN";"Borracha sintética e borracha artificial";"Produtos Semimanufaturados";3135822;3250222
"EXPORTAÇÕES";"Jan-Abr";"2015";"160";"China";"CHN";"Brinquedos, jogos e artigos para diversão e suas partes";"Produtos Manufaturados";623;1
"EXPORTAÇÕES";"Jan-Abr";"2015";"160";"China";"CHN";"Cabos e fibras sintéticas ou artificiais";"Produtos Manufaturados";6992;29120
"EXPORTAÇÕES";"Jan-Abr";"2015";"160";"China";"CHN";"Cacau em pó";"Produtos Semimanufaturados";37634;11550
"EXPORTAÇÕES";"Jan-Abr";"2015";"160";"China";"CHN";"Cachaça e caninha (rum e tafiá)";"Produtos Manufaturados";20182;3695
"EXPORTAÇÕES";"Jan-Abr";"2015";"160";"China";"CHN";"Cadernos, agendas e artigos semelhantes";"Produtos Manufaturados";838;216
"EXPORTAÇÕES";"Jan-Abr";"2015";"160";"China";"CHN";"Café cru em grão";"Produtos Básicos";5604244;1820900
"EXPORTAÇÕES";"Jan-Abr";"2015";"160";"China";"CHN";"Café solúvel";"Produtos Manufaturados";506450;62540
"EXPORTAÇÕES";"Jan-Abr";"2015";"160";"China";"CHN";"Café torrado, descafeinado ou não";"Produtos Básicos";952;175
"EXPORTAÇÕES";"Jan-Abr";"2015";"160";"China";"CHN";"Caixas, sacos e outras embalagens, de papel ou de pasta";"Produtos Manufaturados";2958;785
"EXPORTAÇÕES";"Jan-Abr";"2015";"160";"China";"CHN";"Caixotes, caixas, engradados, etc. de madeira";"Produtos Manufaturados";97543;50222
"EXPORTAÇÕES";"Jan-Abr";"2015";"160";"China";"CHN";"Calçados";"Produtos Manufaturados";815945;30735
"EXPORTAÇÕES";"Jan-Abr";"2015";"160";"China";"CHN";"Câmaras de ar, de borracha";"Produtos Manufaturados";168;11
"EXPORTAÇÕES";"Jan-Abr";"2015";"160";"China";"CHN";"Carne de frango congelada, fresca ou refrig.incl.miudos";"Produtos Básicos";178877714;89086692
"EXPORTAÇÕES";"Jan-Abr";"2015";"160";"China";"CHN";"Carne de suíno congelada, fresca ou refrigerada";"Produtos Básicos";140397;77695
"EXPORTAÇÕES";"Jan-Abr";"2015";"160";"China";"CHN";"Catodos de cobre";"Produtos Semimanufaturados";139623581;23711723
"EXPORTAÇÕES";"Jan-Abr";"2015";"160";"China";"CHN";"Caulim e outras argilas caulinicas";"Produtos Básicos";3436967;24163920
"EXPORTAÇÕES";"Jan-Abr";"2015";"160";"China";"CHN";"Celulose";"Produtos Semimanufaturados";556719300;1194625041
"EXPORTAÇÕES";"Jan-Abr";"2015";"160";"China";"CHN";"Centrifugadores e aparelhos para filtrar ou depurar";"Produtos Manufaturados";634631;23366
"EXPORTAÇÕES";"Jan-Abr";"2015";"160";"China";"CHN";"Centro de usinagem e maqs. estações múltiplas, p/metais";"Produtos Manufaturados";1122206;1009985
"EXPORTAÇÕES";"Jan-Abr";"2015";"160";"China";"CHN";"Ceras vegetais";"Produtos Semimanufaturados";7282375;895000
"EXPORTAÇÕES";"Jan-Abr";"2015";"160";"China";"CHN";"Cerveja de malte";"Produtos Manufaturados";16743;13774
"EXPORTAÇÕES";"Jan-Abr";"2015";"160";"China";"CHN";"Chapas e folhas de borracha vulcanizada não endurecida";"Produtos Manufaturados";264381;16114
"EXPORTAÇÕES";"Jan-Abr";"2015";"160";"China";"CHN";"Chapas, folhas, tiras, películas e laminas, de plástico";"Produtos Manufaturados";590819;49249
"EXPORTAÇÕES";"Jan-Abr";"2015";"160";"China";"CHN";"Chassis com motor e carroçarias p/ veículos automóveis";"Produtos Manufaturados";387300;29400
"EXPORTAÇÕES";"Jan-Abr";"2015";"160";"China";"CHN";"Chocolate e preparações alimentícias com cacau";"Produtos Manufaturados";5800;4000
"EXPORTAÇÕES";"Jan-Abr";"2015";"160";"China";"CHN";"Cilindros hidráulicos";"Produtos Manufaturados";90877;11075
"EXPORTAÇÕES";"Jan-Abr";"2015";"160";"China";"CHN";"Circuitos impressos";"Produtos Manufaturados";128771;1659
"EXPORTAÇÕES";"Jan-Abr";"2015";"160";"China";"CHN";"Circuitos integrados e microconjuntos eletrônicos";"Produtos Manufaturados";3820944;4495
"EXPORTAÇÕES";"Jan-Abr";"2015";"160";"China";"CHN";"Cobre, em barras, perfis, fios, chapas, folhas e tiras";"Produtos Manufaturados";9501979;1537277
"EXPORTAÇÕES";"Jan-Abr";"2015";"160";"China";"CHN";"Colofonias, ácidos resínicos e seus derivados";"Produtos Manufaturados";2530068;1482400
"EXPORTAÇÕES";"Jan-Abr";"2015";"160";"China";"CHN";"Compostos de função cetona ou de função quinona";"Produtos Manufaturados";111760;90700
"EXPORTAÇÕES";"Jan-Abr";"2015";"160";"China";"CHN";"Compostos de funções nitrogenadas";"Produtos Manufaturados";308158;44388
"EXPORTAÇÕES";"Jan-Abr";"2015";"160";"China";"CHN";"Compostos heterocíclicos, seus sais e sulfonamidas";"Produtos Manufaturados";194002;98480
"EXPORTAÇÕES";"Jan-Abr";"2015";"160";"China";"CHN";"Condensadores elétricos, fixos, variáveis ou ajustáveis";"Produtos Manufaturados";5528646;101732
"EXPORTAÇÕES";"Jan-Abr";"2015";"160";"China";"CHN";"Construções e suas partes,de ferro fundido,ferro ou aço";"Produtos Manufaturados";5203;9000
"EXPORTAÇÕES";"Jan-Abr";"2015";"160";"China";"CHN";"Construções pré-fabricadas";"Produtos Manufaturados";1060;30
"EXPORTAÇÕES";"Jan-Abr";"2015";"160";"China";"CHN";"Consumo de bordo - demais";"Operações Especiais";400034;133543
"EXPORTAÇÕES";"Jan-Abr";"2015";"160";"China";"CHN";"Consumo de bordo - óleos e combustíveis";"Operações Especiais";1277975;1790312
"EXPORTAÇÕES";"Jan-Abr";"2015";"160";"China";"CHN";"Cordas e cabos de ferro ou aço,não isolados p/uso eletr";"Produtos Manufaturados";212418;50020
"EXPORTAÇÕES";"Jan-Abr";"2015";"160";"China";"CHN";"Corindo artificial";"Produtos Manufaturados";6360;10000
"EXPORTAÇÕES";"Jan-Abr";"2015";"160";"China";"CHN";"Correia transportadora/transmissão,de borracha vulcaniz";"Produtos Manufaturados";9773;208
"EXPORTAÇÕES";"Jan-Abr";"2015";"160";"China";"CHN";"Correntes, de ferro fundido, ferro ou aço";"Produtos Manufaturados";8395;425
"EXPORTAÇÕES";"Jan-Abr";"2015";"160";"China";"CHN";"Couros e peles, depilados, exceto em bruto";"Produtos Semimanufaturados";234820626;56979037
"EXPORTAÇÕES";"Jan-Abr";"2015";"160";"China";"CHN";"Demais produtos básicos";"Produtos Básicos";51262034;46124465
"EXPORTAÇÕES";"Jan-Abr";"2015";"160";"China";"CHN";"Demais produtos manufaturados";"Produtos Manufaturados";58102056;91179393
"EXPORTAÇÕES";"Jan-Abr";"2015";"160";"China";"CHN";"Demais produtos semimanufaturados";"Produtos Semimanufaturados";17842736;29585326
"EXPORTAÇÕES";"Jan-Abr";"2015";"160";"China";"CHN";"Desperdícios e resíduos de cobre";"Produtos Básicos";10043531;2811778
"EXPORTAÇÕES";"Jan-Abr";"2015";"160";"China";"CHN";"Desperdícios e resíduos de ferro ou aço";"Produtos Básicos";715114;1089940
"EXPORTAÇÕES";"Jan-Abr";"2015";"160";"China";"CHN";"Dextrina e outros amidos e féculas modificados";"Produtos Manufaturados";6984;1440
"EXPORTAÇÕES";"Jan-Abr";"2015";"160";"China";"CHN";"Éteres alcoólicos e seus derivados";"Produtos Manufaturados";1392074;1145897
"EXPORTAÇÕES";"Jan-Abr";"2015";"160";"China";"CHN";"Extratos tanantes de origem vegetal";"Produtos Semimanufaturados";2149768;1391545
"EXPORTAÇÕES";"Jan-Abr";"2015";"160";"China";"CHN";"Extratos,essências,concentrado de café,exc.café solúvel";"Produtos Manufaturados";5193;756
"EXPORTAÇÕES";"Jan-Abr";"2015";"160";"China";"CHN";"Facas, navalhas, aparelhos de barbear e tesouras";"Produtos Manufaturados";21;2
"EXPORTAÇÕES";"Jan-Abr";"2015";"160";"China";"CHN";"Falsos tecidos sintéticos ou artificiais";"Produtos Manufaturados";309859;81532
"EXPORTAÇÕES";"Jan-Abr";"2015";"160";"China";"CHN";"Farelo e resíduos da extração de óleo de soja";"Produtos Básicos";637904;1600000
"EXPORTAÇÕES";"Jan-Abr";"2015";"160";"China";"CHN";"Ferragens para portas e janelas, de metais comuns";"Produtos Manufaturados";479017;36636
"EXPORTAÇÕES";"Jan-Abr";"2015";"160";"China";"CHN";"Ferramentas de uso manual ou para uso em maquinas";"Produtos Manufaturados";1274645;51238
"EXPORTAÇÕES";"Jan-Abr";"2015";"160";"China";"CHN";"Ferramentas eletromecânicas com motor, de uso manual";"Produtos Manufaturados";6400;12301
"EXPORTAÇÕES";"Jan-Abr";"2015";"160";"China";"CHN";"Ferramentas manuais, pneumáticas, hidráulicas, etc.";"Produtos Manufaturados";729493;21639
"EXPORTAÇÕES";"Jan-Abr";"2015";"160";"China";"CHN";"Ferro-ligas";"Produtos Semimanufaturados";231234715;22524894
"EXPORTAÇÕES";"Jan-Abr";"2015";"160";"China";"CHN";"Fibras de vidro e suas obras";"Produtos Manufaturados";7446687;5119674
"EXPORTAÇÕES";"Jan-Abr";"2015";"160";"China";"CHN";"Fio-máquina e barras de ferro ou aços";"Produtos Manufaturados";250495;204289
"EXPORTAÇÕES";"Jan-Abr";"2015";"160";"China";"CHN";"Fios de fibras têxteis, sintéticas ou artificiais";"Produtos Manufaturados";377181;278685
"EXPORTAÇÕES";"Jan-Abr";"2015";"160";"China";"CHN";"Fios, cabos e condutores para uso elétrico";"Produtos Manufaturados";4748686;578259
"EXPORTAÇÕES";"Jan-Abr";"2015";"160";"China";"CHN";"Fitas de fibras sintéticas ou artificiais";"Produtos Manufaturados";941893;135492
"EXPORTAÇÕES";"Jan-Abr";"2015";"160";"China";"CHN";"Fumo em folhas e desperdícios";"Produtos Básicos";1476469;183873
"EXPORTAÇÕES";"Jan-Abr";"2015";"160";"China";"CHN";"Fumo manufaturado e seus sucedâneos";"Produtos Manufaturados";101970;19800
"EXPORTAÇÕES";"Jan-Abr";"2015";"160";"China";"CHN";"Grafita natural";"Produtos Básicos";253223;28000
"EXPORTAÇÕES";"Jan-Abr";"2015";"160";"China";"CHN";"Grupos para condicionamento de ar";"Produtos Manufaturados";194153;3638
"EXPORTAÇÕES";"Jan-Abr";"2015";"160";"China";"CHN";"Guarnições para embreagens";"Produtos Manufaturados";906931;47226
"EXPORTAÇÕES";"Jan-Abr";"2015";"160";"China";"CHN";"Guarnições para freios";"Produtos Manufaturados";171733;76341
"EXPORTAÇÕES";"Jan-Abr";"2015";"160";"China";"CHN";"Heterosídios e alcaloides vegetais,naturais/reproduzido";"Produtos Manufaturados";1471220;57630
"EXPORTAÇÕES";"Jan-Abr";"2015";"160";"China";"CHN";"Hidrocarbonetos e seus derivados halogenados, etc.";"Produtos Manufaturados";213302;82360
"EXPORTAÇÕES";"Jan-Abr";"2015";"160";"China";"CHN";"Inseticidas, formicidas, herbicidas e prods.semelhantes";"Produtos Manufaturados";484312;81125
"EXPORTAÇÕES";"Jan-Abr";"2015";"160";"China";"CHN";"Instrumentos e aparelhos de medida, de verificação,etc.";"Produtos Manufaturados";1745266;119889
"EXPORTAÇÕES";"Jan-Abr";"2015";"160";"China";"CHN";"Instrumentos e aparelhos médicos";"Produtos Manufaturados";473486;13025
"EXPORTAÇÕES";"Jan-Abr";"2015";"160";"China";"CHN";"Instrumentos e aparelhos para navegação aérea";"Produtos Manufaturados";50902;7
"EXPORTAÇÕES";"Jan-Abr";"2015";"160";"China";"CHN";"Iodetos";"Produtos Manufaturados";551750;24000
"EXPORTAÇÕES";"Jan-Abr";"2015";"160";"China";"CHN";"Juntas e gaxetas de borracha vulcanizada não endurecida";"Produtos Manufaturados";774987;11924
"EXPORTAÇÕES";"Jan-Abr";"2015";"160";"China";"CHN";"Laminadores de metais e seus cilindros";"Produtos Manufaturados";7150;10240
"EXPORTAÇÕES";"Jan-Abr";"2015";"160";"China";"CHN";"Lâmpadas, tubos elétricos e faróis";"Produtos Manufaturados";2187;7
"EXPORTAÇÕES";"Jan-Abr";"2015";"160";"China";"CHN";"Lentes para óculos e lentes de contato";"Produtos Manufaturados";2442127;21996
"EXPORTAÇÕES";"Jan-Abr";"2015";"160";"China";"CHN";"Leveduras e outros microorganismos monocelulares,mortos";"Produtos Manufaturados";405181;184003
"EXPORTAÇÕES";"Jan-Abr";"2015";"160";"China";"CHN";"Livros, revistas, jornais e impressos semelhantes";"Produtos Manufaturados";10264;262
"EXPORTAÇÕES";"Jan-Abr";"2015";"160";"China";"CHN";"Madeira compensada ou contraplacada e semelhantes";"Produtos Manufaturados";52275;72336
"EXPORTAÇÕES";"Jan-Abr";"2015";"160";"China";"CHN";"Madeira em estilhas ou em partículas";"Produtos Semimanufaturados";4676303;50174488
"EXPORTAÇÕES";"Jan-Abr";"2015";"160";"China";"CHN";"Madeira laminada";"Produtos Semimanufaturados";545242;828287
"EXPORTAÇÕES";"Jan-Abr";"2015";"160";"China";"CHN";"Madeira perfilada, mesmo aplainada, polida ou unida";"Produtos Manufaturados";104050;174526
"EXPORTAÇÕES";"Jan-Abr";"2015";"160";"China";"CHN";"Madeira serrada ou fendida longitud. de espessura > 6mm";"Produtos Semimanufaturados";12499156;22185504
"EXPORTAÇÕES";"Jan-Abr";"2015";"160";"China";"CHN";"Madeiras em bruto";"Produtos Básicos";1150829;9223995
"EXPORTAÇÕES";"Jan-Abr";"2015";"160";"China";"CHN";"Maquinas-ferramentas para forjar ou trabalhar metais";"Produtos Manufaturados";98302;13139
"EXPORTAÇÕES";"Jan-Abr";"2015";"160";"China";"CHN";"Maquinas automáticas p/process.de dados e suas unidades";"Produtos Manufaturados";567044;4408
"EXPORTAÇÕES";"Jan-Abr";"2015";"160";"China";"CHN";"Máquinas de costura,suas partes e pecas";"Produtos Manufaturados";64281;466
"EXPORTAÇÕES";"Jan-Abr";"2015";"160";"China";"CHN";"Maquinas e aparelhos de elevação de carga,descarga,etc.";"Produtos Manufaturados";326388;53148
"EXPORTAÇÕES";"Jan-Abr";"2015";"160";"China";"CHN";"Maquinas e aparelhos p/ encher, fechar, empacotar, etc.";"Produtos Manufaturados";10757;500
"EXPORTAÇÕES";"Jan-Abr";"2015";"160";"China";"CHN";"Maquinas e aparelhos p/fabr.de pasta celulósica e papel";"Produtos Manufaturados";66018;1323
"EXPORTAÇÕES";"Jan-Abr";"2015";"160";"China";"CHN";"Maquinas e aparelhos p/moldar borracha ou plástico";"Produtos Manufaturados";71541;1956
"EXPORTAÇÕES";"Jan-Abr";"2015";"160";"China";"CHN";"Maquinas e aparelhos p/terraplanagem, perfuração, etc.";"Produtos Manufaturados";207637;718
"EXPORTAÇÕES";"Jan-Abr";"2015";"160";"China";"CHN";"Maquinas e aparelhos p/tratam.de pedra e subst. mineral";"Produtos Manufaturados";619034;66659
"EXPORTAÇÕES";"Jan-Abr";"2015";"160";"China";"CHN";"Maquinas e aparelhos p/uso agrícola (exceto trator)";"Produtos Manufaturados";868329;125380
"EXPORTAÇÕES";"Jan-Abr";"2015";"160";"China";"CHN";"Mármores e granitos, em bruto ou desbastados";"Produtos Básicos";29154406;154076858
"EXPORTAÇÕES";"Jan-Abr";"2015";"160";"China";"CHN";"Matérias corantes orgânicas sintéticas";"Produtos Manufaturados";162727;15335
"EXPORTAÇÕES";"Jan-Abr";"2015";"160";"China";"CHN";"Matérias,desperdícios e resíduos vegetais p/alim.animal";"Produtos Básicos";6684697;8792930
"EXPORTAÇÕES";"Jan-Abr";"2015";"160";"China";"CHN";"Mates de cobre, cobre de cementação (precipit.de cobre)";"Produtos Semimanufaturados";13887500;7744912
"EXPORTAÇÕES";"Jan-Abr";"2015";"160";"China";"CHN";"Medicamentos para medicina humana e veterinária";"Produtos Manufaturados";658747;16324
"EXPORTAÇÕES";"Jan-Abr";"2015";"160";"China";"CHN";"Mel natural";"Produtos Básicos";67715;10381
"EXPORTAÇÕES";"Jan-Abr";"2015";"160";"China";"CHN";"Microfones e alto-falantes e suas partes";"Produtos Manufaturados";105973;6337
"EXPORTAÇÕES";"Jan-Abr";"2015";"160";"China";"CHN";"Milho em grãos";"Produtos Básicos";10063582;51876000
"EXPORTAÇÕES";"Jan-Abr";"2015";"160";"China";"CHN";"Minérios de alumínio e seus concentrados";"Produtos Básicos";7539696;288588000
"EXPORTAÇÕES";"Jan-Abr";"2015";"160";"China";"CHN";"Minérios de chumbo e seus concentrados";"Produtos Básicos";3404953;4995272
"EXPORTAÇÕES";"Jan-Abr";"2015";"160";"China";"CHN";"Minérios de cobre e seus concentrados";"Produtos Básicos";90514363;55868086
"EXPORTAÇÕES";"Jan-Abr";"2015";"160";"China";"CHN";"Minérios de ferro e seus concentrados";"Produtos Básicos";2057373486;49819700752
"EXPORTAÇÕES";"Jan-Abr";"2015";"160";"China";"CHN";"Minérios de manganês e seus concentrados";"Produtos Básicos";13563663;132250190
"EXPORTAÇÕES";"Jan-Abr";"2015";"160";"China";"CHN";"Mistura de subst.odorif.p/ind.alimentar,de bebidas,etc.";"Produtos Manufaturados";824166;105279
"EXPORTAÇÕES";"Jan-Abr";"2015";"160";"China";"CHN";"Molas e folhas de molas, de ferro ou aço";"Produtos Manufaturados";1373214;207959
"EXPORTAÇÕES";"Jan-Abr";"2015";"160";"China";"CHN";"Moldes para metais,vidro,minerais, borracha ou plástico";"Produtos Manufaturados";484377;18430
"EXPORTAÇÕES";"Jan-Abr";"2015";"160";"China";"CHN";"Motocicletas";"Produtos Manufaturados";34864;565
"EXPORTAÇÕES";"Jan-Abr";"2015";"160";"China";"CHN";"Motores à pistão, outros";"Produtos Manufaturados";66055;4765
"EXPORTAÇÕES";"Jan-Abr";"2015";"160";"China";"CHN";"Motores e turbinas para aviação";"Produtos Manufaturados";6000000;2687
"EXPORTAÇÕES";"Jan-Abr";"2015";"160";"China";"CHN";"Motores para veículos automóveis e suas partes";"Produtos Manufaturados";13090274;735018
"EXPORTAÇÕES";"Jan-Abr";"2015";"160";"China";"CHN";"Motores,geradores e transformadores eletr.e suas partes";"Produtos Manufaturados";7541687;751118
"EXPORTAÇÕES";"Jan-Abr";"2015";"160";"China";"CHN";"Moveis e suas partes, exceto medico-cirúrgicos";"Produtos Manufaturados";2403141;396622
"EXPORTAÇÕES";"Jan-Abr";"2015";"160";"China";"CHN";"Mudas, enxertos e plantas vivas";"Produtos Básicos";8643;132
"EXPORTAÇÕES";"Jan-Abr";"2015";"160";"China";"CHN";"Objetos de vidro para uso doméstico ou ornamentação";"Produtos Manufaturados";34966;24766
"EXPORTAÇÕES";"Jan-Abr";"2015";"160";"China";"CHN";"Obras de alumínio";"Produtos Manufaturados";342991;19329
"EXPORTAÇÕES";"Jan-Abr";"2015";"160";"China";"CHN";"Obras de borracha vulcanizada não endurecida, outras";"Produtos Manufaturados";579591;39322
"EXPORTAÇÕES";"Jan-Abr";"2015";"160";"China";"CHN";"Obras de couro natural ou reconstituído";"Produtos Manufaturados";709;1
"EXPORTAÇÕES";"Jan-Abr";"2015";"160";"China";"CHN";"Obras de ferro ou aço, outras";"Produtos Manufaturados";1749981;412165
"EXPORTAÇÕES";"Jan-Abr";"2015";"160";"China";"CHN";"Obras de gálio, háfnio, índio, nióbio, rênio e tálio";"Produtos Manufaturados";2936343;38231
"EXPORTAÇÕES";"Jan-Abr";"2015";"160";"China";"CHN";"Obras de madeira, outras";"Produtos Manufaturados";65681;276999
"EXPORTAÇÕES";"Jan-Abr";"2015";"160";"China";"CHN";"Obras de mármore e granito";"Produtos Manufaturados";819614;452957
"EXPORTAÇÕES";"Jan-Abr";"2015";"160";"China";"CHN";"Obras de plástico, outras";"Produtos Manufaturados";1271899;50535
"EXPORTAÇÕES";"Jan-Abr";"2015";"160";"China";"CHN";"Óleo de soja em bruto";"Produtos Semimanufaturados";15231544;23118830
"EXPORTAÇÕES";"Jan-Abr";"2015";"160";"China";"CHN";"Óleos ácidos de refinação e ácidos graxos industriais";"Produtos Manufaturados";40151;16200
"EXPORTAÇÕES";"Jan-Abr";"2015";"160";"China";"CHN";"Óleos brutos de petróleo";"Produtos Básicos";1330283352;4175887734
"EXPORTAÇÕES";"Jan-Abr";"2015";"160";"China";"CHN";"Óleos essenciais e seus subprodutos";"Produtos Manufaturados";5850730;1816691
"EXPORTAÇÕES";"Jan-Abr";"2015";"160";"China";"CHN";"Óleos lubrificantes";"Produtos Manufaturados";290277;96595
"EXPORTAÇÕES";"Jan-Abr";"2015";"160";"China";"CHN";"Órgãos e substâncias de animais, p/prepar.prods.farmac.";"Produtos Básicos";89410;8
"EXPORTAÇÕES";"Jan-Abr";"2015";"160";"China";"CHN";"Outs.sucos de frutas ou prods. hortícolas, cong. ou não";"Produtos Manufaturados";614900;46325
"EXPORTAÇÕES";"Jan-Abr";"2015";"160";"China";"CHN";"Óxidos e hidróxidos de alumínio";"Produtos Manufaturados";2088369;6691206
"EXPORTAÇÕES";"Jan-Abr";"2015";"160";"China";"CHN";"Óxidos e hidróxidos de ferro";"Produtos Manufaturados";53837;83000
"EXPORTAÇÕES";"Jan-Abr";"2015";"160";"China";"CHN";"Painéis de partículas e painéis semelhantes, de madeira";"Produtos Manufaturados";292787;657501
"EXPORTAÇÕES";"Jan-Abr";"2015";"160";"China";"CHN";"Papel e cartão kraft, em rolos ou em folhas";"Produtos Manufaturados";535261;866735
"EXPORTAÇÕES";"Jan-Abr";"2015";"160";"China";"CHN";"Papel e cartão revestidos, impregnados, recobertos,etc.";"Produtos Manufaturados";39;39
"EXPORTAÇÕES";"Jan-Abr";"2015";"160";"China";"CHN";"Papel e cartão, para escrita,impressão ou fins gráficos";"Produtos Manufaturados";38152238;37823588
"EXPORTAÇÕES";"Jan-Abr";"2015";"160";"China";"CHN";"Papel p/fabricação de papel higiênico, lenço ou toalha";"Produtos Manufaturados";3415;3700
"EXPORTAÇÕES";"Jan-Abr";"2015";"160";"China";"CHN";"Parafusos,pinos,porcas e artefs.semelhs.de ferro ou aço";"Produtos Manufaturados";1033245;103415
"EXPORTAÇÕES";"Jan-Abr";"2015";"160";"China";"CHN";"Partes de calçados";"Produtos Manufaturados";187957;36067
"EXPORTAÇÕES";"Jan-Abr";"2015";"160";"China";"CHN";"Partes e acessórios de equipam. p/movimentação de carga";"Produtos Manufaturados";195384;269017
"EXPORTAÇÕES";"Jan-Abr";"2015";"160";"China";"CHN";"Partes e acessórios de maqs.automat.p/process. de dados";"Produtos Manufaturados";2911342;22013
"EXPORTAÇÕES";"Jan-Abr";"2015";"160";"China";"CHN";"Partes e acessórios para maquinas-ferramentas";"Produtos Manufaturados";236278;1598
"EXPORTAÇÕES";"Jan-Abr";"2015";"160";"China";"CHN";"Partes e pecas de aviões,helicópteros,outs.veíc. aéreos";"Produtos Manufaturados";5036900;4207
"EXPORTAÇÕES";"Jan-Abr";"2015";"160";"China";"CHN";"Partes e pecas para veículos automóveis e tratores";"Produtos Manufaturados";5300822;396202
"EXPORTAÇÕES";"Jan-Abr";"2015";"160";"China";"CHN";"Pedras p/calcetar, placas p/paviment. de pedra natural";"Produtos Semimanufaturados";53170;161085
"EXPORTAÇÕES";"Jan-Abr";"2015";"160";"China";"CHN";"Pedras preciosas ou semipreciosas, trabalhadas";"Produtos Manufaturados";7413224;780091
"EXPORTAÇÕES";"Jan-Abr";"2015";"160";"China";"CHN";"Pedras preciosas ou semipreciosas,em bruto,não engastad";"Produtos Básicos";2394998;1959676
"EXPORTAÇÕES";"Jan-Abr";"2015";"160";"China";"CHN";"Peixes congelados, frescos ou refrigerados";"Produtos Básicos";302648;154530
"EXPORTAÇÕES";"Jan-Abr";"2015";"160";"China";"CHN";"Peleteria, exceto em bruto";"Produtos Semimanufaturados";110328;15363
"EXPORTAÇÕES";"Jan-Abr";"2015";"160";"China";"CHN";"Perfis e fios, de ferro ou aço";"Produtos Manufaturados";230385;180876
